income_change_by_income_category_universe_adult_stayers_with_income_information_at_start_and_annual_assessment,had_income_category_at_start_and_did_not_have_it_at_annual_assessment,retained_income_category_but_had_less_at_annual_assessment_than_at_start,retained_income_category_and_same_at_annual_assessment_as_at_start,retained_income_category_and_increased_at_annual_assessment,did_not_have_the_income_category_at_start_and_gained_the_income_category_at_annual_assessment,did_not_have_the_income_category_at_start_or_at_annual_assessment,total_adults_including_those_with_no_income,performance_measure_adults_who_gained_or_increased_income_from_start_to_annual_assessment,average_gain,performance_measure_percent_of_persons_who_accomplished_this_measure,population,start_date,end_date,question
"Number of Adults with Earned Income (ie.e, Employment Income)",3,0,4,2,1,46,59,4,0.07,NA,all_persons,2020-07-01,2020-07-31,Q19a1
Average Change in Earned Income,-1008.0,0.0,0,407.5,1474.0,0,0,749.25,0,NA,all_persons,2020-07-01,2020-07-31,Q19a1
Number of Adults with Other Income,3,2,9,23,1,21,59,24,0.41,NA,all_persons,2020-07-01,2020-07-31,Q19a1
Average Change in Other Income,-991.0,-754.5,0,585.35,771.0,0,0,593.08,0,NA,all_persons,2020-07-01,2020-07-31,Q19a1
"Number of Adults with Any Income (i.e., Total Income)",4,3,12,25,2,10,59,28,0.47,NA,all_persons,2020-07-01,2020-07-31,Q19a1
Average Change in Overall Income,-1005.75,-753.0,0,522.16,1122.5,0,169,571.68,0,NA,all_persons,2020-07-01,2020-07-31,Q19a1
