income_change_by_income_category_universe_adult_stayers_with_income_information_at_start_and_annual_assessment,had_income_category_at_start_and_did_not_have_it_at_annual_assessment,retained_income_category_but_had_less_at_annual_assessment_than_at_start,retained_income_category_and_same_at_annual_assessment_as_at_start,retained_income_category_and_increased_at_annual_assessment,did_not_have_the_income_category_at_start_and_gained_the_income_category_at_annual_assessment,did_not_have_the_income_category_at_start_or_at_annual_assessment,total_adults_including_those_with_no_income,performance_measure_adults_who_gained_or_increased_income_from_start_to_annual_assessment,average_gain,performance_measure_percent_of_persons_who_accomplished_this_measure,population,start_date,end_date,question
"Number of Adults with Earned Income (ie.e, Employment Income)",3,0,2,3,3,40,53,7,0.13,NA,all_persons,2022-08-01,2022-08-31,Q19a1
Average Change in Earned Income,-842.67,0.0,0,1510.0,1359.67,0,0,1390.14,0,NA,all_persons,2022-08-01,2022-08-31,Q19a1
Number of Adults with Other Income,1,3,1,25,7,16,53,32,0.6,NA,all_persons,2022-08-01,2022-08-31,Q19a1
Average Change in Other Income,-721.0,-696.0,0,416.08,1004.0,0,0,544.69,0,NA,all_persons,2022-08-01,2022-08-31,Q19a1
"Number of Adults with Any Income (i.e., Total Income)",3,3,1,30,6,8,53,37,0.7,NA,all_persons,2022-08-01,2022-08-31,Q19a1
Average Change in Overall Income,-840.33,-696.0,0,593.4,1251.5,0,435,714.41,0,NA,all_persons,2022-08-01,2022-08-31,Q19a1
