income_change_by_income_category_universe_adult_leavers_with_income_information_at_start_and_exit,had_income_category_at_start_and_did_not_have_it_at_exit,retained_income_category_but_had_less_at_exit_than_at_start,retained_income_category_and_same_at_exit_as_at_start,retained_income_category_and_increased_at_exit,did_not_have_the_income_category_at_start_and_gained_the_income_category_at_exit,did_not_have_the_income_category_at_start_or_at_exit,total_adults_including_those_with_no_income,performance_measure_adults_who_gained_or_increased_income_from_start_to_exit,average_gain,performance_measure_percent_of_persons_who_accomplished_this_measure,population,start_date,end_date,question
"Number of Adults with Earned Income (ie.e, Employment Income)",1,0,75,5,4,127,216,10,0.05,NA,all_persons,2019-01-01,2019-01-31,Q19a2
Average Change in Earned Income,-1106.0,0.0,0,1840.0,1868.5,0,0,1807.4,0,NA,all_persons,2019-01-01,2019-01-31,Q19a2
Number of Adults with Other Income,0,0,61,0,0,155,216,0,0.0,NA,all_persons,2019-01-01,2019-01-31,Q19a2
Average Change in Other Income,0.0,0.0,0,0.0,0.0,0,0,0.0,0,NA,all_persons,2019-01-01,2019-01-31,Q19a2
"Number of Adults with Any Income (i.e., Total Income)",1,0,127,7,2,75,216,10,0.05,NA,all_persons,2019-01-01,2019-01-31,Q19a2
Average Change in Overall Income,-1106.0,0.0,0,2050.0,1162.0,0,78,1807.4,0,NA,all_persons,2019-01-01,2019-01-31,Q19a2
