income_change_by_income_category_universe_adult_stayers_with_income_information_at_start_and_annual_assessment,had_income_category_at_start_and_did_not_have_it_at_annual_assessment,retained_income_category_but_had_less_at_annual_assessment_than_at_start,retained_income_category_and_same_at_annual_assessment_as_at_start,retained_income_category_and_increased_at_annual_assessment,did_not_have_the_income_category_at_start_and_gained_the_income_category_at_annual_assessment,did_not_have_the_income_category_at_start_or_at_annual_assessment,total_adults_including_those_with_no_income,performance_measure_adults_who_gained_or_increased_income_from_start_to_annual_assessment,average_gain,performance_measure_percent_of_persons_who_accomplished_this_measure,population,start_date,end_date,question
"Number of Adults with Earned Income (ie.e, Employment Income)",2,1,3,2,3,43,56,6,0.11,NA,all_persons,2022-03-01,2022-03-31,Q19a1
Average Change in Earned Income,-964.0,-200.0,0,1188.0,2132.0,0,0,1643.33,0,NA,all_persons,2022-03-01,2022-03-31,Q19a1
Number of Adults with Other Income,2,3,3,24,8,16,56,32,0.57,NA,all_persons,2022-03-01,2022-03-31,Q19a1
Average Change in Other Income,-735.5,-696.0,0,443.0,973.63,0,0,575.66,0,NA,all_persons,2022-03-01,2022-03-31,Q19a1
"Number of Adults with Any Income (i.e., Total Income)",2,5,4,28,8,7,56,37,0.66,NA,all_persons,2022-03-01,2022-03-31,Q19a1
Average Change in Overall Income,-960.5,-607.6,0,551.43,1378.13,0,411,744.68,0,NA,all_persons,2022-03-01,2022-03-31,Q19a1
