income_change_by_income_category_universe_adult_stayers_with_income_information_at_start_and_annual_assessment,had_income_category_at_start_and_did_not_have_it_at_annual_assessment,retained_income_category_but_had_less_at_annual_assessment_than_at_start,retained_income_category_and_same_at_annual_assessment_as_at_start,retained_income_category_and_increased_at_annual_assessment,did_not_have_the_income_category_at_start_and_gained_the_income_category_at_annual_assessment,did_not_have_the_income_category_at_start_or_at_annual_assessment,total_adults_including_those_with_no_income,performance_measure_adults_who_gained_or_increased_income_from_start_to_annual_assessment,average_gain,performance_measure_percent_of_persons_who_accomplished_this_measure,population,start_date,end_date,question
"Number of Adults with Earned Income (ie.e, Employment Income)",0,0,3,0,1,38,46,2,0.04,NA,all_persons,2018-06-01,2018-06-30,Q19a1
Average Change in Earned Income,0.0,0.0,0,0.0,578.0,0,0,974.0,0,NA,all_persons,2018-06-01,2018-06-30,Q19a1
Number of Adults with Other Income,1,4,10,14,3,14,46,17,0.37,NA,all_persons,2018-06-01,2018-06-30,Q19a1
Average Change in Other Income,-623.0,-671.0,0,821.93,1066.0,0,0,865.0,0,NA,all_persons,2018-06-01,2018-06-30,Q19a1
"Number of Adults with Any Income (i.e., Total Income)",1,4,12,15,3,7,46,19,0.41,NA,all_persons,2018-06-01,2018-06-30,Q19a1
Average Change in Overall Income,-623.0,-671.0,0,805.6,1066.0,0,306,876.42,0,NA,all_persons,2018-06-01,2018-06-30,Q19a1
