income_change_by_income_category_universe_adult_leavers_with_income_information_at_start_and_exit,had_income_category_at_start_and_did_not_have_it_at_exit,retained_income_category_but_had_less_at_exit_than_at_start,retained_income_category_and_same_at_exit_as_at_start,retained_income_category_and_increased_at_exit,did_not_have_the_income_category_at_start_and_gained_the_income_category_at_exit,did_not_have_the_income_category_at_start_or_at_exit,total_adults_including_those_with_no_income,performance_measure_adults_who_gained_or_increased_income_from_start_to_exit,average_gain,performance_measure_percent_of_persons_who_accomplished_this_measure,population,start_date,end_date,question
"Number of Adults with Earned Income (ie.e, Employment Income)",1,0,26,3,5,62,103,8,0.08,NA,all_persons,2018-06-01,2018-06-30,Q19a2
Average Change in Earned Income,-672.0,0.0,0,1706.67,1691.4,0,0,1697.13,0,NA,all_persons,2018-06-01,2018-06-30,Q19a2
Number of Adults with Other Income,1,1,27,3,2,66,103,5,0.05,NA,all_persons,2018-06-01,2018-06-30,Q19a2
Average Change in Other Income,-454.0,-350.0,0,386.67,906.5,0,0,594.6,0,NA,all_persons,2018-06-01,2018-06-30,Q19a2
"Number of Adults with Any Income (i.e., Total Income)",1,1,49,7,5,31,103,13,0.13,NA,all_persons,2018-06-01,2018-06-30,Q19a2
Average Change in Overall Income,-454.0,-350.0,0,1006.0,2043.6,0,187,1331.69,0,NA,all_persons,2018-06-01,2018-06-30,Q19a2
