income_change_by_income_category_universe_adult_leavers_with_income_information_at_start_and_exit,had_income_category_at_start_and_did_not_have_it_at_exit,retained_income_category_but_had_less_at_exit_than_at_start,retained_income_category_and_same_at_exit_as_at_start,retained_income_category_and_increased_at_exit,did_not_have_the_income_category_at_start_and_gained_the_income_category_at_exit,did_not_have_the_income_category_at_start_or_at_exit,total_adults_including_those_with_no_income,performance_measure_adults_who_gained_or_increased_income_from_start_to_exit,average_gain,performance_measure_percent_of_persons_who_accomplished_this_measure,population,start_date,end_date,question
"Number of Adults with Earned Income (ie.e, Employment Income)",2,0,38,0,3,77,124,3,0.02,NA,all_persons,2016-12-01,2016-12-31,Q19a2
Average Change in Earned Income,-1005.0,0.0,0,0.0,822.33,0,0,822.33,0,NA,all_persons,2016-12-01,2016-12-31,Q19a2
Number of Adults with Other Income,1,2,24,1,0,91,124,1,0.01,NA,all_persons,2016-12-01,2016-12-31,Q19a2
Average Change in Other Income,-739.0,-112.5,0,1154.0,0.0,0,0,1154.0,0,NA,all_persons,2016-12-01,2016-12-31,Q19a2
"Number of Adults with Any Income (i.e., Total Income)",2,3,56,2,2,50,124,4,0.03,NA,all_persons,2016-12-01,2016-12-31,Q19a2
Average Change in Overall Income,-594.5,-595.0,0,764.0,1046.5,0,11,905.25,0,NA,all_persons,2016-12-01,2016-12-31,Q19a2
