income_change_by_income_category_universe_adult_leavers_with_income_information_at_start_and_exit,had_income_category_at_start_and_did_not_have_it_at_exit,retained_income_category_but_had_less_at_exit_than_at_start,retained_income_category_and_same_at_exit_as_at_start,retained_income_category_and_increased_at_exit,did_not_have_the_income_category_at_start_and_gained_the_income_category_at_exit,did_not_have_the_income_category_at_start_or_at_exit,total_adults_including_those_with_no_income,performance_measure_adults_who_gained_or_increased_income_from_start_to_exit,average_gain,performance_measure_percent_of_persons_who_accomplished_this_measure,population,start_date,end_date,question
"Number of Adults with Earned Income (ie.e, Employment Income)",1,0,23,3,2,113,147,5,0.03,NA,all_persons,2022-02-01,2022-02-28,Q19a2
Average Change in Earned Income,-1388.0,0.0,0,1193.67,1362.5,0,0,1261.2,0,NA,all_persons,2022-02-01,2022-02-28,Q19a2
Number of Adults with Other Income,1,0,22,2,2,117,147,4,0.03,NA,all_persons,2022-02-01,2022-02-28,Q19a2
Average Change in Other Income,-2371.0,0.0,0,433.0,1370.5,0,0,901.75,0,NA,all_persons,2022-02-01,2022-02-28,Q19a2
"Number of Adults with Any Income (i.e., Total Income)",1,1,41,6,1,89,147,7,0.05,NA,all_persons,2022-02-01,2022-02-28,Q19a2
Average Change in Overall Income,-1388.0,-771.0,0,1245.33,841.0,0,24,1187.57,0,NA,all_persons,2022-02-01,2022-02-28,Q19a2
